mysql> SELECT * FROM Account;
+----+------------------+----------+---------------------+---------------------+
| id | email            | password | createdOn           | modifiedOn          |
+----+------------------+----------+---------------------+---------------------+
|  1 | example@test.com | password | 2016-12-12 00:00:00 | 2017-01-23 00:00:00 |
+----+------------------+----------+---------------------+---------------------+
1 row in set (0.00 sec)

mysql> UPDATE Account SET password = 'secret' WHERE id = 1;
Query OK, 1 row affected (0.02 sec)
Rows matched: 1  Changed: 1  Warnings: 0

mysql> SELECT * FROM Account;
+----+------------------+----------+---------------------+---------------------+
| id | email            | password | createdOn           | modifiedOn          |
+----+------------------+----------+---------------------+---------------------+
|  1 | example@test.com | secret   | 2016-12-12 00:00:00 | 2017-01-23 00:00:00 |
+----+------------------+----------+---------------------+---------------------+
1 row in set (0.00 sec)


*****************************************************

mysql> SELECT * FROM AddressBook;
+----+-----------+---------------+---------------------+---------------------+
| id | accountId | name          | createdOn           | modifiedOn          |
+----+-----------+---------------+---------------------+---------------------+
|  3 |        20 | Aurelien Roux | 2016-12-14 00:00:00 | 2017-01-22 00:00:00 |
+----+-----------+---------------+---------------------+---------------------+
1 row in set (0.00 sec)

UPDATE AddressBook SET createdOn = '2016-01-01' WHERE id = 3;   
Query OK, 1 row affected (0.01 sec)
Rows matched: 1  Changed: 1  Warnings: 0

mysql> SELECT * FROM AddressBook;
+----+-----------+---------------+---------------------+---------------------+
| id | accountId | name          | createdOn           | modifiedOn          |
+----+-----------+---------------+---------------------+---------------------+
|  3 |        20 | Aurelien Roux | 2016-01-01 00:00:00 | 2017-01-22 00:00:00 |
+----+-----------+---------------+---------------------+---------------------+
1 row in set (0.00 sec)


****************************************************

mysql> SELECT * FROM Entry;
+----+---------------+-----------+----------+---------------------+-------+---------+----------------+----------------+------------------+-----------------+-----------------+
| id | addressBookId | firstName | lastName | birthday            | type  | subtype | contentLineOne | contentLineTwo | contentLineThree | contentLineFour | contentLineFive |
+----+---------------+-----------+----------+---------------------+-------+---------+----------------+----------------+------------------+-----------------+-----------------+
|  1 |            13 | Aurelien  | Roux     | 1981-04-02 00:00:00 | home  | address | Montreal       | Quebec         | Canada           | France          | Plateau         |
|  2 |            13 | Nathan    | Roux     | 2014-11-04 00:00:00 | work  | phone   | Paris          | Quebec         | Canada           | France          | Plateau         |
|  3 |            13 | Adrien    | Roux     | 2013-01-04 00:00:00 | other | phone   | Paris          | Quebec         | Canada           | France          | Rosemont        |
+----+---------------+-----------+----------+---------------------+-------+---------+----------------+----------------+------------------+-----------------+-----------------+
3 rows in set (0.00 sec)

mysql> UPDATE Entry SET addressBookId = 14;
Query OK, 3 rows affected (0.00 sec)
Rows matched: 3  Changed: 3  Warnings: 0

mysql> SELECT * FROM Entry;
+----+---------------+-----------+----------+---------------------+-------+---------+----------------+----------------+------------------+-----------------+-----------------+
| id | addressBookId | firstName | lastName | birthday            | type  | subtype | contentLineOne | contentLineTwo | contentLineThree | contentLineFour | contentLineFive |
+----+---------------+-----------+----------+---------------------+-------+---------+----------------+----------------+------------------+-----------------+-----------------+
|  1 |            14 | Aurelien  | Roux     | 1981-04-02 00:00:00 | home  | address | Montreal       | Quebec         | Canada           | France          | Plateau         |
|  2 |            14 | Nathan    | Roux     | 2014-11-04 00:00:00 | work  | phone   | Paris          | Quebec         | Canada           | France          | Plateau         |
|  3 |            14 | Adrien    | Roux     | 2013-01-04 00:00:00 | other | phone   | Paris          | Quebec         | Canada           | France          | Rosemont        |
+----+---------------+-----------+----------+---------------------+-------+---------+----------------+----------------+------------------+-----------------+-----------------+
3 rows in set (0.00 sec)

